-- Permissive mode (coldfront.allow_mixed_writes = on, default): an ambiguous
-- predicate triggers a dual-tier CTE that writes to both tiers in the same
-- statement. Strict mode (off) still rejects such predicates with ERROR.
CREATE EXTENSION IF NOT EXISTS pg_duckdb;
NOTICE:  extension "pg_duckdb" already exists, skipping
CREATE EXTENSION IF NOT EXISTS coldfront;
NOTICE:  extension "coldfront" already exists, skipping
SET TIME ZONE 'UTC';
SET coldfront.warehouse = '';
SET coldfront.lakekeeper_endpoint = '';
CREATE TABLE public._events (id int, ts timestamptz, status text);
CREATE VIEW public.events AS SELECT * FROM public._events;
INSERT INTO coldfront.tiered_views(view_oid, hot_table, iceberg_table, partition_col)
VALUES ('public.events'::regclass, 'public._events', 'ice.default.events', 'ts');
INSERT INTO coldfront.archive_watermark(table_name, cutoff_time)
VALUES ('events', '2026-03-01'::timestamptz);
-- Default GUC value is permissive (on)
SHOW coldfront.allow_mixed_writes;
 coldfront.allow_mixed_writes 
------------------------------
 on
(1 row)

-- Permissive: ambiguous predicate (no ts constraint) → dual-tier CTE.
-- The plan should contain both a hot UPDATE on _events and a cold
-- duckdb.raw_query call.
SET coldfront.allow_mixed_writes = on;
EXPLAIN (COSTS OFF, VERBOSE)
  UPDATE public.events SET status = 'x' WHERE id = 1;
                                                                     QUERY PLAN                                                                      
-----------------------------------------------------------------------------------------------------------------------------------------------------
 Nested Loop
   Output: h.id, h.ts, h.status
   CTE hot
     ->  Update on public._events
           Output: _events.id, _events.ts, _events.status
           ->  Seq Scan on public._events
                 Output: 'x'::text, _events.ctid
                 Filter: (_events.id = 1)
   CTE cold
     ->  Result
           Output: _exec_iceberg_with_claim('ice.default.events'::text, 'UPDATE ice.default.events SET status = ''x''::text   WHERE (id = 1)'::text)
   ->  CTE Scan on cold c
         Output: c._exec_iceberg_with_claim
   ->  CTE Scan on hot h
         Output: h.id, h.ts, h.status
(15 rows)

-- Strict: same statement → ERROR
SET coldfront.allow_mixed_writes = off;
UPDATE public.events SET status = 'x' WHERE id = 1;
ERROR:  UPDATE/DELETE on tiered view "events" must include a WHERE condition on "ts" that targets one tier
HINT:  Use "ts >= <value>" for hot-tier writes, "ts < <value>" for cold-tier writes, or set coldfront.allow_mixed_writes = on to permit a non-atomic dual-tier rewrite.
-- Hot-only and cold-only are unaffected by the GUC (same output either way).
SET coldfront.allow_mixed_writes = off;
EXPLAIN (COSTS OFF)
  UPDATE public.events SET status = 'hot' WHERE ts = '2026-04-01 12:00:00+00';
                                   QUERY PLAN                                    
---------------------------------------------------------------------------------
 Update on _events
   ->  Seq Scan on _events
         Filter: (ts = 'Wed Apr 01 12:00:00 2026 UTC'::timestamp with time zone)
(3 rows)

SET coldfront.allow_mixed_writes = on;
EXPLAIN (COSTS OFF)
  UPDATE public.events SET status = 'hot' WHERE ts = '2026-04-01 12:00:00+00';
                                   QUERY PLAN                                    
---------------------------------------------------------------------------------
 Update on _events
   ->  Seq Scan on _events
         Filter: (ts = 'Wed Apr 01 12:00:00 2026 UTC'::timestamp with time zone)
(3 rows)

-- Reset
RESET coldfront.allow_mixed_writes;
-- Cleanup. Unregister before dropping: the DDL hook blocks DROP of a
-- registered tiered table/view.
DELETE FROM coldfront.tiered_views;
DELETE FROM coldfront.archive_watermark;
DROP VIEW public.events;
DROP TABLE public._events;
